{
  "service_code": "caste_certificate",
  "service_name": "Caste Certificate",
  "jurisdiction": {
    "state": "Karnataka"
  },
  "requirements": [
    {
      "type": "REQUIRED",
      "document": "aadhaar",
      "mandatory": true,
      "evidence_refs": [
        "EV-KA-CASTE-003"
      ],
      "citizen_exposure": "EXPOSE"
    },
    {
      "type": "REQUIRED",
      "document": "address_proof",
      "mandatory": true,
      "evidence_refs": [
        "EV-KA-CASTE-003"
      ],
      "citizen_exposure": "EXPOSE"
    },
    {
      "type": "REQUIRED",
      "document": "caste_community_proof",
      "mandatory": true,
      "evidence_refs": [
        "EV-KA-CASTE-003"
      ],
      "citizen_exposure": "EXPOSE"
    }
  ],
  "fees": [
    {
      "amount": null,
      "currency": "INR",
      "evidence_refs": [],
      "conflicts": [],
      "status": "NOT_VERIFIED"
    }
  ],
  "officer_workflow": [
    {
      "authority": "Village Accountant",
      "role": "verification",
      "evidence_refs": [
        "EV-KA-CASTE-006"
      ],
      "status": "VERIFIED"
    },
    {
      "authority": "Tahsildar",
      "role": "approving",
      "evidence_refs": [
        "EV-KA-CASTE-006"
      ],
      "status": "VERIFIED"
    },
    {
      "authority": "Tahsildar",
      "role": "issuing",
      "evidence_refs": [
        "EV-KA-CASTE-006"
      ],
      "status": "VERIFIED"
    }
  ],
  "document_dependencies": [],
  "processing_time": {
    "value": 21,
    "unit": "DAYS",
    "evidence_refs": [
      "EV-KA-CASTE-005"
    ],
    "conflicts": [],
    "status": "VERIFIED"
  }
}