{
  "service_code": "death_certificate",
  "service_name": "Death Certificate",
  "jurisdiction": {
    "state": "Karnataka"
  },
  "requirements": [
    {
      "type": "CONDITIONAL",
      "document": "written_permission_prescribed_authority",
      "mandatory": true,
      "evidence_refs": [
        "EV-KA-DEATH-001"
      ],
      "citizen_exposure": "EXPOSE",
      "condition_description": "Delayed > 30 days and <= 1 year requires written permission from the prescribed authority."
    },
    {
      "type": "CONDITIONAL",
      "document": "magistrate_order",
      "mandatory": true,
      "evidence_refs": [
        "EV-KA-DEATH-002"
      ],
      "citizen_exposure": "EXPOSE",
      "condition_description": "Delayed > 1 year requires an order from a Magistrate."
    },
    {
      "type": "UNKNOWN",
      "document": "identity_proof",
      "mandatory": false,
      "evidence_refs": [],
      "citizen_exposure": "DO_NOT_EXPOSE"
    }
  ],
  "fees": [
    {
      "amount": null,
      "currency": "INR",
      "evidence_refs": [
        "EV-KA-DEATH-001",
        "EV-KA-DEATH-002"
      ],
      "conflicts": [],
      "status": "VERIFIED",
      "condition_description": "Delayed registration"
    },
    {
      "amount": 0,
      "currency": "INR",
      "evidence_refs": [
        "EV-KA-DEATH-005"
      ],
      "conflicts": [],
      "status": "VERIFIED",
      "condition_description": "Normal registration within 21 days"
    }
  ],
  "officer_workflow": [
    {
      "authority": "Tahsildar or Commissioner/Chief Officer of Municipality",
      "role": "approving",
      "evidence_refs": [
        "EV-KA-DEATH-001"
      ],
      "status": "VERIFIED"
    },
    {
      "authority": "Sub-Divisional Magistrate or Executive Magistrate",
      "role": "approving",
      "evidence_refs": [
        "EV-KA-DEATH-002"
      ],
      "status": "VERIFIED"
    },
    {
      "authority": "Village Accountant (Rural) or Health Officer/Inspector (Urban)",
      "role": "verification",
      "evidence_refs": [
        "EV-KA-DEATH-003"
      ],
      "status": "VERIFIED"
    },
    {
      "authority": "Village Accountant (Rural) or Health Officer/Inspector (Urban)",
      "role": "issuing",
      "evidence_refs": [
        "EV-KA-DEATH-003"
      ],
      "status": "VERIFIED"
    }
  ],
  "document_dependencies": [],
  "processing_time": {
    "value": 21,
    "unit": "DAYS",
    "evidence_refs": [
      "EV-KA-DEATH-004"
    ],
    "conflicts": [],
    "status": "VERIFIED"
  }
}