{
  "service_code": "residence_certificate",
  "service_name": "Residence Certificate",
  "jurisdiction": {
    "state": "Karnataka"
  },
  "requirements": [
    {
      "type": "REQUIRED",
      "document": "aadhaar",
      "mandatory": true,
      "evidence_refs": [
        "EV-KA-RES-001"
      ],
      "citizen_exposure": "EXPOSE"
    },
    {
      "type": "REQUIRED",
      "document": "address_proof",
      "mandatory": true,
      "evidence_refs": [
        "EV-KA-RES-001"
      ],
      "citizen_exposure": "EXPOSE"
    }
  ],
  "fees": [
    {
      "amount": null,
      "currency": "INR",
      "evidence_refs": [],
      "conflicts": [],
      "status": "NOT_VERIFIED"
    }
  ],
  "officer_workflow": [
    {
      "authority": "Village Accountant / Revenue Inspector",
      "role": "verification",
      "evidence_refs": [
        "EV-KA-RES-001"
      ],
      "status": "VERIFIED"
    },
    {
      "authority": "Tahsildar / Deputy Tahsildar",
      "role": "approving",
      "evidence_refs": [
        "EV-KA-RES-001"
      ],
      "status": "VERIFIED"
    },
    {
      "authority": "Tahsildar / Deputy Tahsildar",
      "role": "issuing",
      "evidence_refs": [
        "EV-KA-RES-001"
      ],
      "status": "VERIFIED"
    }
  ],
  "document_dependencies": []
}